{
  "formatVersion": 1,
  "id": "20261001-m3-setup-protection-preview",
  "title": "Implement Setup preview and non-vacuous protection status",
  "goal": "Report exact local setup readiness and protection proof without applying Target or remote changes.",
  "acceptanceCriteria": [
    "Setup preview reports ordered typed steps and marks Target, composition and remote apply unavailable.",
    "Protected requires every accepted V4-AD-040 proof and cannot follow from a no-op Profile or local pass.",
    "Unavailable CI enforcement is explicit and forces protected false rather than being inferred from workflow text.",
    "Preview identity changes on authoritative input drift and stale confirmation is rejected."
  ],
  "plannedPaths": [
    "core/application/contracts/setup-preview.schema.json",
    "core/application/contracts/protection-status.schema.json",
    "core/host/V4.Guards.Host/ApplicationRuntime.cs",
    "core/application/validation/Test-V4ApplicationBoundary.ps1",
    "docs/plans/20261001-m3-setup-protection-preview.md",
    "docs/plans/20261001-m3-setup-protection-preview.plan.json"
  ],
  "areas": ["application", "contracts", "host", "tests"],
  "risks": ["A local pass or workflow file could be misreported as enforced protection."],
  "decisions": ["Fail closed unless every protection component has positive exact proof."],
  "validationCommands": ["pwsh -NoProfile -File core/application/validation/Test-V4ApplicationBoundary.ps1", "pwsh -NoProfile -File tests/p8/Test-V4CompatibilityBaseline.ps1"],
  "dependencies": [],
  "boundaries": []
}

