{
  "formatVersion": 1,
  "id": "20261001-v4-guards-1-2-0-release-authorization",
  "title": "授权 V4 Guards 1.2.0 compatibility baseline 重绑定（P5 R0）",
  "goal": "为 1.2.0 版本 PR 增加一次性、base-held 的 compatibility-baseline 变更授权记录。",
  "acceptanceCriteria": [
    "受信任 base runner 将本 PR 判定为 authorization-added，且 required checks 全部通过。",
    "授权只绑定 core/certification/compatibility-baseline.json 从 3abaa984… 到 66f824cb… 的精确字节变更。",
    "记录指向独立的 consuming Plan 20261001-v4-guards-1-2-0-release，并禁止 candidate Host 自我裁决。"
  ],
  "plannedPaths": [
    "docs/plans/20261001-v4-guards-1-2-0-release-authorization.md",
    "docs/plans/20261001-v4-guards-1-2-0-release-authorization.plan.json",
    "docs/plans/authorizations/20261001-v4-guards-1-2-0-release-record.json"
  ],
  "areas": [
    "GuardDocs"
  ],
  "risks": [
    "授权哈希若与最终 candidate 字节不同，consuming PR 必须失败关闭并重新授权。"
  ],
  "decisions": [
    "这是两 PR 流程的 authorization 步骤，不修改版本、baseline 或发布状态。",
    "compatibility baseline 的 pluginVersion 1.1.0 与 apiVersion 1.0 保持历史 API 基线语义。"
  ],
  "validationCommands": [
    "v4-contract",
    "v4-linux",
    "v4-package",
    "v4-required"
  ],
  "dependencies": [],
  "boundaries": [
    "authorization"
  ]
}
