{
  "formatVersion": 1,
  "id": "20260928-v4-todo-008-t8-records",
  "title": "V4-TODO-008 T8 records",
  "goal": "Record the completed IFX cleanup (T8) and close V4-TODO-008 in the Guard checklist, receipt and product TODO.",
  "acceptanceCriteria": [
    "The records match the IFX T8 Plan outcome and cleanup receipt, and the PR passes v4-required and merges without bypass."
  ],
  "plannedPaths": [
    "docs/migration/v4-todo-008/migration-receipt.json",
    "docs/plans/20260928-v4-todo-008-t8-records.md",
    "docs/plans/20260928-v4-todo-008-t8-records.plan.json",
    "docs/plans/migration/20260927-v4-todo-008-execution-checklist.md",
    "docs/plans/product/TODO.md"
  ],
  "areas": [
    "GuardDocs"
  ],
  "risks": [
    "Records could overstate completion as activation, P10.GATE or V3 retirement."
  ],
  "decisions": [
    "Keep v4Activated, p10GatePassed and v3Retired false."
  ],
  "validationCommands": [
    "v4-contract",
    "v4-linux",
    "v4-package",
    "v4-required"
  ],
  "dependencies": [],
  "boundaries": []
}
