{
  "formatVersion": 1,
  "id": "20260928-v4-guards-1-1-6-release-authorization",
  "title": "Authorize the V4 Guards 1.1.6 version bump (G3 R0)",
  "goal": "Add the single-use authorization record for the 1.1.6 compatibility-baseline rebind.",
  "acceptanceCriteria": [
    "The base-owned V4 runner decides this step as the V4-TODO-014 two-PR trust-change flow expects."
  ],
  "plannedPaths": [
    "docs/plans/20260928-v4-guards-1-1-6-release-authorization.md",
    "docs/plans/20260928-v4-guards-1-1-6-release-authorization.plan.json",
    "docs/plans/authorizations/20260928-v4-guards-1-1-6-release-record.json"
  ],
  "areas": [
    "GuardDocs"
  ],
  "risks": [],
  "decisions": [
    "Authorization step of the V4-TODO-014 two-PR flow for the V4 Guards 1.1.6 release."
  ],
  "validationCommands": [
    "v4-contract",
    "v4-linux",
    "v4-package",
    "v4-required"
  ],
  "dependencies": [],
  "boundaries": [
    "authorization"
  ]
}
