{
  "formatVersion": 1,
  "id": "20261001-m1-pr-documentation-root",
  "title": "Own the M1 PR decision and planning paths",
  "goal": "Provide unique exact path ownership for the decision planning and product-index portion of the M1 PR root plan-set.",
  "acceptanceCriteria": [
    "Every decision and planning path changed by the branch has one owner.",
    "Shared product indexes and the ignored discussion-memory boundary are included.",
    "No product Target workflow ruleset release or remote behavior is authorized by this member."
  ],
  "plannedPaths": [
    ".gitignore",
    "docs/plans/20261001-m1-foundation-decisions.md",
    "docs/plans/20261001-m1-foundation-decisions.plan.json",
    "docs/plans/20261001-m1-foundation-implementation.plan-set.json",
    "docs/plans/20261001-m1-governance-adoption.md",
    "docs/plans/20261001-m1-governance-adoption.plan.json",
    "docs/plans/20261001-m1-implementation-program.md",
    "docs/plans/20261001-m1-implementation-program.plan.json",
    "docs/plans/20261001-m1-installed-launcher.md",
    "docs/plans/20261001-m1-installed-launcher.plan.json",
    "docs/plans/20261001-m1-m5-decision-set-formalization.md",
    "docs/plans/20261001-m1-m5-decision-set-formalization.plan.json",
    "docs/plans/20261001-m1-pr-documentation-root.md",
    "docs/plans/20261001-m1-pr-documentation-root.plan.json",
    "docs/plans/20261001-m1-project-initialization.md",
    "docs/plans/20261001-m1-project-initialization.plan.json",
    "docs/plans/20261001-m1-runtime-distribution.md",
    "docs/plans/20261001-m1-runtime-distribution.plan.json",
    "docs/plans/20261001-m1-storage-retention.md",
    "docs/plans/20261001-m1-storage-retention.plan.json",
    "docs/plans/20261001-m1-version-lifecycle.md",
    "docs/plans/20261001-m1-version-lifecycle.plan.json",
    "docs/plans/20261001-m2-profile-authority-decision.md",
    "docs/plans/20261001-m2-profile-authority-decision.plan.json",
    "docs/plans/20261001-m3-ui-application-boundary-decision.md",
    "docs/plans/20261001-m3-ui-application-boundary-decision.plan.json",
    "docs/plans/20261001-m4-stage-and-evidence-decision.md",
    "docs/plans/20261001-m4-stage-and-evidence-decision.plan.json",
    "docs/plans/20261001-m5-module-ecosystem-decision.md",
    "docs/plans/20261001-m5-module-ecosystem-decision.plan.json",
    "docs/plans/20261001-m5-plan-governance-decision.md",
    "docs/plans/20261001-m5-plan-governance-decision.plan.json",
    "docs/plans/20261001-m5-target-trust-authorization-decision.md",
    "docs/plans/20261001-m5-target-trust-authorization-decision.plan.json",
    "docs/plans/product/00-architecture-decision-set.md",
    "docs/plans/product/README.md",
    "docs/plans/product/TODO.md"
  ],
  "areas": ["GuardDocs"],
  "risks": ["A PR-level wrapper could be mistaken for new product authority."],
  "decisions": ["Use a two-member PR root plan-set solely to provide unique exact path ownership."],
  "validationCommands": ["v4-contract", "exact plan-set diff"],
  "dependencies": [],
  "boundaries": []
}
