{
  "formatVersion": 1,
  "id": "20260928-v4-todo-014-p6-command-probe-authorization",
  "title": "Authorize the P6 isolated-command regression control",
  "goal": "Add the single-use authorization for the P6 PATHEXT regression probe.",
  "acceptanceCriteria": [
    "The base-owned V4 runner decides this live acceptance step as the V4-TODO-014 Plan expects."
  ],
  "plannedPaths": [
    "docs/plans/20260928-v4-todo-014-p6-command-probe-authorization.md",
    "docs/plans/20260928-v4-todo-014-p6-command-probe-authorization.plan.json",
    "docs/plans/authorizations/20260928-v4-todo-014-p6-command-probe-record.json"
  ],
  "areas": [
    "GuardDocs"
  ],
  "risks": [],
  "decisions": [
    "Live acceptance step of Plan 20260928-v4-todo-014-trust-change-authorization (B2)."
  ],
  "validationCommands": [
    "v4-contract",
    "v4-linux",
    "v4-package",
    "v4-required"
  ],
  "dependencies": [],
  "boundaries": [
    "authorization"
  ]
}
